[
    {
        "requirement_number_year": "0001/2024",
        "fiscal_name": "KAIZEN GAMING BRASIL LTDA",
        "document": "46.786.961/0001-74",
        "brand": "BETANO",
        "domain": "betano.bet.br"
    },
    {
        "requirement_number_year": "0001/2024",
        "fiscal_name": "KAIZEN GAMING BRASIL LTDA",
        "document": "46.786.961/0001-74",
        "brand": "SUPERBET",
        "domain": "superbet.bet.br"
    },
    {
        "requirement_number_year": "0001/2024",
        "fiscal_name": "KAIZEN GAMING BRASIL LTDA",
        "document": "46.786.961/0001-74",
        "brand": "MAGICJACKPOT",
        "domain": "magicjackpot.bet.br"
    },
    {
        "requirement_number_year": "0001/2024",
        "fiscal_name": "KAIZEN GAMING BRASIL LTDA",
        "document": "46.786.961/0001-74",
        "brand": "SUPER",
        "domain": "super.bet.br"
    },
    {
        "requirement_number_year": "0001/2024",
        "fiscal_name": "KAIZEN GAMING BRASIL LTDA",
        "document": "46.786.961/0001-74",
        "brand": "REI DO PITACO",
        "domain": "reidopitaco.bet.br"
    },
    {
        "requirement_number_year": "0001/2024",
        "fiscal_name": "KAIZEN GAMING BRASIL LTDA",
        "document": "46.786.961/0001-74",
        "brand": "PITACO",
        "domain": "pitaco.bet.br"
    },
    {
        "requirement_number_year": "0001/2024",
        "fiscal_name": "KAIZEN GAMING BRASIL LTDA",
        "document": "46.786.961/0001-74",
        "brand": "SPORTINGBET",
        "domain": "sportingbet.bet.br"
    },
    {
        "requirement_number_year": "0001/2024",
        "fiscal_name": "KAIZEN GAMING BRASIL LTDA",
        "document": "46.786.961/0001-74",
        "brand": "BETBOO",
        "domain": "betboo.bet.br"
    },
    {
        "requirement_number_year": "0005/2024",
        "fiscal_name": "BIG BRAZIL TECNOLOGIA E LOTERIA S.A.",
        "document": "41.590.869/0001-10",
        "brand": "CAESARS",
        "domain": "caesars.bet.br"
    },
    {
        "requirement_number_year": "0005/2024",
        "fiscal_name": "BIG BRAZIL TECNOLOGIA E LOTERIA S.A.",
        "document": "41.590.869/0001-10",
        "brand": "BETNACIONAL",
        "domain": "betnacional.bet.br"
    },
    {
        "requirement_number_year": "0005/2024",
        "fiscal_name": "BIG BRAZIL TECNOLOGIA E LOTERIA S.A.",
        "document": "41.590.869/0001-10",
        "brand": "MR. JACK BET",
        "domain": "mrjack.bet.br"
    },
    {
        "requirement_number_year": "0007/2024",
        "fiscal_name": "APOLLO OPERATIONS LTDA",
        "document": "54.923.003/0001-26",
        "brand": "KTO",
        "domain": "kto.bet.br"
    },
    {
        "requirement_number_year": "0008/2024",
        "fiscal_name": "SIMULCASTING BRASIL SOM E IMAGEM S.A.",
        "document": "17.385.948/0001-05",
        "brand": "BETSSON",
        "domain": "betsson.bet.br"
    },
    {
        "requirement_number_year": "0009/2024",
        "fiscal_name": "GALERA GAMING JOGOS ELETRONICOS S.A.",
        "document": "31.853.299/0001-50",
        "brand": "GALERA.BET",
        "domain": "galera.bet.br"
    },
    {
        "requirement_number_year": "0012/2024",
        "fiscal_name": "EB INTERMEDIACOES E JOGOS S.A.",
        "document": "52.639.845/0001-25",
        "brand": "ESTRELABET",
        "domain": "estrelabet.bet.br"
    },
    {
        "requirement_number_year": "0012/2024",
        "fiscal_name": "EB INTERMEDIACOES E JOGOS S.A.",
        "document": "52.639.845/0001-25",
        "brand": "REALS",
        "domain": "reals.bet.br"
    },
    {
        "requirement_number_year": "0012/2024",
        "fiscal_name": "EB INTERMEDIACOES E JOGOS S.A.",
        "document": "52.639.845/0001-25",
        "brand": "UX",
        "domain": "ux.bet.br"
    },
    {
        "requirement_number_year": "0014/2024",
        "fiscal_name": "BETFAIR BRASIL LTDA",
        "document": "55.229.080/0001-43",
        "brand": "BETFAIR",
        "domain": "betfair.bet.br"
    },
    {
        "requirement_number_year": "0014/2024",
        "fiscal_name": "BETFAIR BRASIL LTDA",
        "document": "55.229.080/0001-43",
        "brand": "7GAMES",
        "domain": "7games.bet.br"
    },
    {
        "requirement_number_year": "0014/2024",
        "fiscal_name": "BETFAIR BRASIL LTDA",
        "document": "55.229.080/0001-43",
        "brand": "BET√ÉO",
        "domain": "betao.bet.br"
    },
    {
        "requirement_number_year": "0014/2024",
        "fiscal_name": "BETFAIR BRASIL LTDA",
        "document": "55.229.080/0001-43",
        "brand": "R7",
        "domain": "r7.bet.br"
    },
    {
        "requirement_number_year": "0017/2024",
        "fiscal_name": "NVBT GAMING LTDA",
        "document": "50.587.712/0001-27",
        "brand": "NOVIBET",
        "domain": "novibet.bet.br"
    },
    {
        "requirement_number_year": "0017/2024",
        "fiscal_name": "NVBT GAMING LTDA",
        "document": "50.587.712/0001-27",
        "brand": "SEGURO BET",
        "domain": "seguro.bet.br"
    },
    {
        "requirement_number_year": "0017/2024",
        "fiscal_name": "NVBT GAMING LTDA",
        "document": "50.587.712/0001-27",
        "brand": "KING PANDA",
        "domain": "kingpanda.bet.br"
    },
    {
        "requirement_number_year": "0017/2024",
        "fiscal_name": "NVBT GAMING LTDA",
        "document": "50.587.712/0001-27",
        "brand": "9F",
        "domain": "9f.bet.br"
    },
    {
        "requirement_number_year": "0017/2024",
        "fiscal_name": "NVBT GAMING LTDA",
        "document": "50.587.712/0001-27",
        "brand": "6R",
        "domain": "6r.bet.br"
    },
    {
        "requirement_number_year": "0017/2024",
        "fiscal_name": "NVBT GAMING LTDA",
        "document": "50.587.712/0001-27",
        "brand": "BET.APP",
        "domain": "betapp.bet.br"
    },
    {
        "requirement_number_year": "0017/2024",
        "fiscal_name": "NVBT GAMING LTDA",
        "document": "50.587.712/0001-27",
        "brand": "IJOGO",
        "domain": "ijogo.bet.br"
    },
    {
        "requirement_number_year": "0017/2024",
        "fiscal_name": "NVBT GAMING LTDA",
        "document": "50.587.712/0001-27",
        "brand": "FOGO777",
        "domain": "fogo777.bet.br"
    },
    {
        "requirement_number_year": "0017/2024",
        "fiscal_name": "NVBT GAMING LTDA",
        "document": "50.587.712/0001-27",
        "brand": "P9",
        "domain": "p9.bet.br"
    },
    {
        "requirement_number_year": "0021/2024",
        "fiscal_name": "HS DO BRASIL LTDA",
        "document": "47.123.407/0001-70",
        "brand": "BET365",
        "domain": "bet365.bet.br"
    },
    {
        "requirement_number_year": "0022/2024",
        "fiscal_name": "APOSTA GANHA LOTERIAS LTDA",
        "document": "56.001.749/0001-08",
        "brand": "APOSTA GANHA",
        "domain": "apostaganha.bet.br"
    },
    {
        "requirement_number_year": "0023/2024",
        "fiscal_name": "FUTURAS APOSTAS LTDA",
        "document": "55.399.607/0001-88",
        "brand": "BRAZINO777",
        "domain": "brazino777.bet.br"
    },
    {
        "requirement_number_year": "0023/2024",
        "fiscal_name": "FUTURAS APOSTAS LTDA",
        "document": "55.399.607/0001-88",
        "brand": "4PLAY",
        "domain": "4play.bet.br"
    },
    {
        "requirement_number_year": "0023/2024",
        "fiscal_name": "FUTURAS APOSTAS LTDA",
        "document": "55.399.607/0001-88",
        "brand": "PAGOL",
        "domain": "pagol.bet.br"
    },
    {
        "requirement_number_year": "0055/2024",
        "fiscal_name": "TQJ-PAR PARTICIPACOES SOCIETARIAS S.A.",
        "document": "55.238.676/0001-00",
        "brand": "VERTBET",
        "domain": "vert.bet.br"
    },
    {
        "requirement_number_year": "0055/2024",
        "fiscal_name": "TQJ-PAR PARTICIPACOES SOCIETARIAS S.A.",
        "document": "55.238.676/0001-00",
        "brand": "CBET",
        "domain": "cgg.bet.br"
    },
    {
        "requirement_number_year": "0055/2024",
        "fiscal_name": "TQJ-PAR PARTICIPACOES SOCIETARIAS S.A.",
        "document": "55.238.676/0001-00",
        "brand": "FANBIT",
        "domain": "fanbit.bet.br"
    },
    {
        "requirement_number_year": "0055/2024",
        "fiscal_name": "TQJ-PAR PARTICIPACOES SOCIETARIAS S.A.",
        "document": "55.238.676/0001-00",
        "brand": "UPBETBR",
        "domain": "up.bet.br"
    }
]